{"public_digest":{"algorithm":"sha256","synthetic":true,"value":"340df0ed2b33db6c05805891258dda789f445e300084a0e347ee318044d3191b"},"schema_version":"1.0.0","synthetic":true,"truth":[{"applicable_control_ids":["control:change-approval"],"applicable_policy_rule_ids":["rule-standard"],"applicable_policy_version_id":"policy-v1","approver_authorised_at_decision":true,"audit_reconstructable":true,"authority_change_id":"change-01","canonical_accountable_owner_chain":["principal:owner"],"canonical_after_state":{"authorities":[{"actions":["read"],"authority_id":"authority-01","capability_id":"capability:01","purpose":"bounded governance conformance","resource_id":"resource:01","scopes":["scope:regional"],"subject_id":"principal:subject-01","synthetic":true,"valid_from_tick":0,"valid_until_tick":null}],"synthetic":true},"canonical_approval_chain":["principal:approver-valid"],"canonical_before_state":{"authorities":[],"synthetic":true},"canonical_requester_principal_id":"principal:requester-01","case_kind":"properly_approved_grant","change_type":"grant","controlling_decision_id":"decision:change-01:a","enactment_consistent":true,"expected_decision_outcome":"approved","expected_effective_tick":3,"expected_exception_id":null,"expected_rationale_code":"business_need","failure_reasons":[],"governance_decision_authorised":true,"required_decision_evidence_refs":["evidence:change-01:approval","evidence:change-01:policy","evidence:change-01:request"],"superseded_authority_change_id":null,"synthetic":true},{"applicable_control_ids":["control:change-approval"],"applicable_policy_rule_ids":["rule-standard"],"applicable_policy_version_id":"policy-v1","approver_authorised_at_decision":false,"audit_reconstructable":true,"authority_change_id":"change-02","canonical_accountable_owner_chain":["principal:owner"],"canonical_after_state":{"authorities":[{"actions":["read"],"authority_id":"authority-02","capability_id":"capability:02","purpose":"bounded governance conformance","resource_id":"resource:02","scopes":["scope:regional"],"subject_id":"principal:subject-02","synthetic":true,"valid_from_tick":0,"valid_until_tick":null}],"synthetic":true},"canonical_approval_chain":["principal:approver-wrong"],"canonical_before_state":{"authorities":[],"synthetic":true},"canonical_requester_principal_id":"principal:requester-02","case_kind":"wrong_approver","change_type":"grant","controlling_decision_id":"decision:change-02:a","enactment_consistent":true,"expected_decision_outcome":"approved","expected_effective_tick":13,"expected_exception_id":null,"expected_rationale_code":"business_need","failure_reasons":["approver_not_authorised"],"governance_decision_authorised":false,"required_decision_evidence_refs":["evidence:change-02:approval","evidence:change-02:policy","evidence:change-02:request"],"superseded_authority_change_id":null,"synthetic":true},{"applicable_control_ids":["control:change-approval"],"applicable_policy_rule_ids":["rule-standard"],"applicable_policy_version_id":"policy-v1","approver_authorised_at_decision":true,"audit_reconstructable":true,"authority_change_id":"change-03","canonical_accountable_owner_chain":["principal:owner"],"canonical_after_state":{"authorities":[{"actions":["read","write"],"authority_id":"authority-03","capability_id":"capability:03","purpose":"bounded governance conformance","resource_id":"resource:03","scopes":["scope:global"],"subject_id":"principal:subject-03","synthetic":true,"valid_from_tick":0,"valid_until_tick":null}],"synthetic":true},"canonical_approval_chain":["principal:approver-valid"],"canonical_before_state":{"authorities":[{"actions":["read","write"],"authority_id":"authority-03","capability_id":"capability:03","purpose":"bounded governance conformance","resource_id":"resource:03","scopes":["scope:global"],"subject_id":"principal:subject-03","synthetic":true,"valid_from_tick":0,"valid_until_tick":null}],"synthetic":true},"canonical_requester_principal_id":"principal:requester-03","case_kind":"approved_scope_differs","change_type":"attenuate","controlling_decision_id":"decision:change-03:a","enactment_consistent":false,"expected_decision_outcome":"partially_approved","expected_effective_tick":23,"expected_exception_id":null,"expected_rationale_code":"business_need","failure_reasons":["approved_scope_differs_from_enacted_scope"],"governance_decision_authorised":true,"required_decision_evidence_refs":["evidence:change-03:approval","evidence:change-03:policy","evidence:change-03:request"],"superseded_authority_change_id":null,"synthetic":true},{"applicable_control_ids":["control:deny"],"applicable_policy_rule_ids":["rule-deny"],"applicable_policy_version_id":"policy-v1","approver_authorised_at_decision":true,"audit_reconstructable":true,"authority_change_id":"change-04","canonical_accountable_owner_chain":["principal:owner"],"canonical_after_state":{"authorities":[{"actions":["read"],"authority_id":"authority-04","capability_id":"capability:04","purpose":"bounded governance conformance","resource_id":"resource:04","scopes":["scope:regional"],"subject_id":"principal:subject-04","synthetic":true,"valid_from_tick":0,"valid_until_tick":null}],"synthetic":true},"canonical_approval_chain":["principal:approver-valid"],"canonical_before_state":{"authorities":[],"synthetic":true},"canonical_requester_principal_id":"principal:requester-04","case_kind":"denied_request_enacted","change_type":"grant","controlling_decision_id":"decision:change-04:a","enactment_consistent":false,"expected_decision_outcome":"denied","expected_effective_tick":33,"expected_exception_id":null,"expected_rationale_code":"prohibited_scope","failure_reasons":["denied_request_enacted"],"governance_decision_authorised":false,"required_decision_evidence_refs":["evidence:change-04:approval","evidence:change-04:policy","evidence:change-04:request"],"superseded_authority_change_id":null,"synthetic":true},{"applicable_control_ids":["control:emergency-exception"],"applicable_policy_rule_ids":["rule-emergency"],"applicable_policy_version_id":"policy-v1","approver_authorised_at_decision":true,"audit_reconstructable":true,"authority_change_id":"change-05","canonical_accountable_owner_chain":["principal:owner"],"canonical_after_state":{"authorities":[{"actions":["read"],"authority_id":"authority-05","capability_id":"capability:05","purpose":"bounded governance conformance","resource_id":"resource:05","scopes":["scope:regional"],"subject_id":"principal:subject-05","synthetic":true,"valid_from_tick":0,"valid_until_tick":48}],"synthetic":true},"canonical_approval_chain":["principal:approver-emergency"],"canonical_before_state":{"authorities":[],"synthetic":true},"canonical_requester_principal_id":"principal:requester-05","case_kind":"valid_emergency_exception","change_type":"grant","controlling_decision_id":"decision:change-05:a","enactment_consistent":true,"expected_decision_outcome":"approved","expected_effective_tick":43,"expected_exception_id":"exception:emergency-05","expected_rationale_code":"emergency_response","failure_reasons":[],"governance_decision_authorised":true,"required_decision_evidence_refs":["evidence:change-05:approval","evidence:change-05:exception","evidence:change-05:policy","evidence:change-05:request"],"superseded_authority_change_id":null,"synthetic":true},{"applicable_control_ids":["control:change-approval"],"applicable_policy_rule_ids":["rule-standard"],"applicable_policy_version_id":"policy-v1","approver_authorised_at_decision":false,"audit_reconstructable":true,"authority_change_id":"change-06","canonical_accountable_owner_chain":["principal:owner"],"canonical_after_state":{"authorities":[{"actions":["read"],"authority_id":"authority-06","capability_id":"capability:06","purpose":"bounded governance conformance","resource_id":"resource:06","scopes":["scope:regional"],"subject_id":"principal:subject-06","synthetic":true,"valid_from_tick":0,"valid_until_tick":null}],"synthetic":true},"canonical_approval_chain":["principal:approver-expired"],"canonical_before_state":{"authorities":[],"synthetic":true},"canonical_requester_principal_id":"principal:requester-06","case_kind":"expired_approver_authority","change_type":"grant","controlling_decision_id":"decision:change-06:a","enactment_consistent":true,"expected_decision_outcome":"approved","expected_effective_tick":61,"expected_exception_id":null,"expected_rationale_code":"business_need","failure_reasons":["approver_authority_expired"],"governance_decision_authorised":false,"required_decision_evidence_refs":["evidence:change-06:approval","evidence:change-06:policy","evidence:change-06:request"],"superseded_authority_change_id":null,"synthetic":true},{"applicable_control_ids":["control:change-approval"],"applicable_policy_rule_ids":["rule-standard"],"applicable_policy_version_id":"policy-v1","approver_authorised_at_decision":true,"audit_reconstructable":true,"authority_change_id":"change-07","canonical_accountable_owner_chain":["principal:owner"],"canonical_after_state":{"authorities":[{"actions":["read"],"authority_id":"authority-07","capability_id":"capability:07","purpose":"bounded governance conformance","resource_id":"resource:07","scopes":["scope:regional"],"subject_id":"principal:subject-07","synthetic":true,"valid_from_tick":0,"valid_until_tick":null}],"synthetic":true},"canonical_approval_chain":["principal:approver-valid"],"canonical_before_state":{"authorities":[],"synthetic":true},"canonical_requester_principal_id":"principal:requester-07","case_kind":"policy_changed_after_decision","change_type":"grant","controlling_decision_id":"decision:change-07:a","enactment_consistent":true,"expected_decision_outcome":"approved","expected_effective_tick":66,"expected_exception_id":null,"expected_rationale_code":"business_need","failure_reasons":[],"governance_decision_authorised":true,"required_decision_evidence_refs":["evidence:change-07:approval","evidence:change-07:policy","evidence:change-07:request"],"superseded_authority_change_id":null,"synthetic":true},{"applicable_contro